{
  "version": 1,
  "meta": {
    "id": "demo-apartment",
    "name": "Demo Apartment",
    "author": "DomoView contributors",
    "license": "CC0-1.0",
    "description": "A fictional six-room apartment with a west balcony, used to demonstrate DomoView. Not a real home.",
    "north": 0,
    "version": "1.0.0"
  },
  "plan": {
    "image": null,
    "imageWidth": 1500,
    "imageHeight": 900,
    "opacity": 0.5,
    "scale": 0.01,
    "calibration": null
  },
  "level": {
    "height": 2.55,
    "elevation": 0
  },
  "walls": [
    {
      "id": "ext_n",
      "a": [
        200,
        0
      ],
      "b": [
        1300,
        0
      ],
      "thickness": 0.26,
      "height": 2.55,
      "exterior": true,
      "flip": true
    },
    {
      "id": "ext_e",
      "a": [
        1300,
        0
      ],
      "b": [
        1300,
        800
      ],
      "thickness": 0.26,
      "height": 2.55,
      "exterior": true,
      "flip": true
    },
    {
      "id": "ext_s",
      "a": [
        1300,
        800
      ],
      "b": [
        200,
        800
      ],
      "thickness": 0.26,
      "height": 2.55,
      "exterior": true,
      "flip": true
    },
    {
      "id": "ext_w",
      "a": [
        200,
        800
      ],
      "b": [
        200,
        0
      ],
      "thickness": 0.26,
      "height": 2.55,
      "exterior": true,
      "flip": true
    },
    {
      "id": "part_v",
      "a": [
        750,
        0
      ],
      "b": [
        750,
        800
      ],
      "thickness": 0.115,
      "height": 2.55,
      "exterior": false,
      "flip": false
    },
    {
      "id": "part_h",
      "a": [
        200,
        520
      ],
      "b": [
        1300,
        520
      ],
      "thickness": 0.115,
      "height": 2.55,
      "exterior": false,
      "flip": false
    },
    {
      "id": "part_kitchen",
      "a": [
        750,
        300
      ],
      "b": [
        1300,
        300
      ],
      "thickness": 0.115,
      "height": 2.55,
      "exterior": false,
      "flip": false
    },
    {
      "id": "part_bath",
      "a": [
        1000,
        300
      ],
      "b": [
        1000,
        520
      ],
      "thickness": 0.115,
      "height": 2.55,
      "exterior": false,
      "flip": false
    }
  ],
  "rooms": [
    {
      "id": "living",
      "name": "Living & Dining",
      "polygon": [
        [
          200,
          0
        ],
        [
          750,
          0
        ],
        [
          750,
          520
        ],
        [
          200,
          520
        ]
      ],
      "outdoor": false,
      "label": null,
      "climate": true
    },
    {
      "id": "kitchen",
      "name": "Kitchen",
      "polygon": [
        [
          750,
          0
        ],
        [
          1300,
          0
        ],
        [
          1300,
          300
        ],
        [
          750,
          300
        ]
      ],
      "outdoor": false,
      "label": null,
      "climate": true
    },
    {
      "id": "corridor",
      "name": "Corridor",
      "polygon": [
        [
          750,
          300
        ],
        [
          1000,
          300
        ],
        [
          1000,
          520
        ],
        [
          750,
          520
        ]
      ],
      "outdoor": false,
      "label": null,
      "climate": true
    },
    {
      "id": "bathroom",
      "name": "Bathroom",
      "polygon": [
        [
          1000,
          300
        ],
        [
          1300,
          300
        ],
        [
          1300,
          520
        ],
        [
          1000,
          520
        ]
      ],
      "outdoor": false,
      "label": null,
      "climate": true
    },
    {
      "id": "study",
      "name": "Study",
      "polygon": [
        [
          200,
          520
        ],
        [
          750,
          520
        ],
        [
          750,
          800
        ],
        [
          200,
          800
        ]
      ],
      "outdoor": false,
      "label": null,
      "climate": true
    },
    {
      "id": "bedroom",
      "name": "Bedroom",
      "polygon": [
        [
          750,
          520
        ],
        [
          1300,
          520
        ],
        [
          1300,
          800
        ],
        [
          750,
          800
        ]
      ],
      "outdoor": false,
      "label": null,
      "climate": true
    },
    {
      "id": "balcony",
      "name": "Balcony",
      "polygon": [
        [
          0,
          100
        ],
        [
          190,
          100
        ],
        [
          190,
          600
        ],
        [
          0,
          600
        ]
      ],
      "outdoor": true,
      "label": null,
      "climate": true
    }
  ],
  "openings": [
    {
      "id": "op_1",
      "type": "window",
      "name": "Living room west",
      "wall": "ext_w",
      "offset": 650,
      "width": 1.5,
      "sill": 0.9,
      "head": 2.3,
      "rooms": [
        "living"
      ],
      "mullion": null,
      "cover": true,
      "coverProfile": "venetian",
      "coverInFront": false
    },
    {
      "id": "op_2",
      "type": "glass_door",
      "name": "Balcony door",
      "wall": "ext_w",
      "offset": 450,
      "width": 1.8,
      "sill": 0.02,
      "head": 2.3,
      "rooms": [
        "living"
      ],
      "mullion": 0,
      "cover": true,
      "coverProfile": "venetian",
      "coverInFront": false
    },
    {
      "id": "op_3",
      "type": "window",
      "name": "Study west",
      "wall": "ext_w",
      "offset": 120,
      "width": 1.2,
      "sill": 0.9,
      "head": 2.3,
      "rooms": [
        "study"
      ],
      "mullion": null,
      "cover": true,
      "coverProfile": "roller",
      "coverInFront": false
    },
    {
      "id": "op_4",
      "type": "window",
      "name": "Kitchen north",
      "wall": "ext_n",
      "offset": 800,
      "width": 1.4,
      "sill": 1.05,
      "head": 2.3,
      "rooms": [
        "kitchen"
      ],
      "mullion": null,
      "cover": true,
      "coverProfile": "venetian",
      "coverInFront": false
    },
    {
      "id": "op_5",
      "type": "window",
      "name": "Bathroom east",
      "wall": "ext_e",
      "offset": 409.99999999999994,
      "width": 0.8,
      "sill": 1.35,
      "head": 2.2,
      "rooms": [
        "bathroom"
      ],
      "mullion": null,
      "cover": false,
      "coverProfile": "venetian",
      "coverInFront": false
    },
    {
      "id": "op_6",
      "type": "window",
      "name": "Bedroom east",
      "wall": "ext_e",
      "offset": 660,
      "width": 1.6,
      "sill": 0.9,
      "head": 2.3,
      "rooms": [
        "bedroom"
      ],
      "mullion": null,
      "cover": true,
      "coverProfile": "roller",
      "coverInFront": false
    },
    {
      "id": "op_7",
      "type": "window",
      "name": "Bedroom south",
      "wall": "ext_s",
      "offset": 350,
      "width": 1.6,
      "sill": 0.9,
      "head": 2.3,
      "rooms": [
        "bedroom"
      ],
      "mullion": null,
      "cover": true,
      "coverProfile": "roller",
      "coverInFront": false
    },
    {
      "id": "op_8",
      "type": "window",
      "name": "Study south",
      "wall": "ext_s",
      "offset": 900,
      "width": 1.4,
      "sill": 0.9,
      "head": 2.3,
      "rooms": [
        "study"
      ],
      "mullion": null,
      "cover": true,
      "coverProfile": "roller",
      "coverInFront": false
    },
    {
      "id": "op_9",
      "type": "door",
      "name": "Corridor to living",
      "wall": "part_v",
      "offset": 420,
      "width": 0.9,
      "sill": 0,
      "head": 2.05,
      "rooms": [],
      "mullion": null,
      "cover": false,
      "coverProfile": "venetian",
      "coverInFront": false
    },
    {
      "id": "op_10",
      "type": "door",
      "name": "Study door",
      "wall": "part_h",
      "offset": 250,
      "width": 0.9,
      "sill": 0,
      "head": 2.05,
      "rooms": [],
      "mullion": null,
      "cover": false,
      "coverProfile": "venetian",
      "coverInFront": false
    },
    {
      "id": "op_11",
      "type": "door",
      "name": "Bedroom door",
      "wall": "part_h",
      "offset": 700,
      "width": 0.9,
      "sill": 0,
      "head": 2.05,
      "rooms": [],
      "mullion": null,
      "cover": false,
      "coverProfile": "venetian",
      "coverInFront": false
    },
    {
      "id": "op_12",
      "type": "door",
      "name": "Bathroom door",
      "wall": "part_bath",
      "offset": 120,
      "width": 0.8,
      "sill": 0,
      "head": 2.05,
      "rooms": [],
      "mullion": null,
      "cover": false,
      "coverProfile": "venetian",
      "coverInFront": false
    },
    {
      "id": "op_13",
      "type": "door",
      "name": "Kitchen opening",
      "wall": "part_kitchen",
      "offset": 150,
      "width": 1.1,
      "sill": 0,
      "head": 2.05,
      "rooms": [],
      "mullion": null,
      "cover": false,
      "coverProfile": "venetian",
      "coverInFront": false
    }
  ],
  "fixtures": [
    {
      "id": "fx_1",
      "name": "Living ceiling spots",
      "kind": "light",
      "room": "living",
      "emitters": [
        {
          "point": [
            360,
            140
          ],
          "height": 2.5,
          "type": "spot",
          "intensity": 1,
          "angle": 45
        },
        {
          "point": [
            490.00000000000006,
            229.99999999999997
          ],
          "height": 2.5,
          "type": "spot",
          "intensity": 1,
          "angle": 45
        },
        {
          "point": [
            360,
            340
          ],
          "height": 2.5,
          "type": "spot",
          "intensity": 1,
          "angle": 45
        }
      ],
      "lumens": 1400,
      "color": "#fff0d4",
      "range": 7,
      "shadow": true,
      "bulb": "glow",